{
  "budgets": {
    "steps_max": 120,
    "steps_used": 0
  },
  "context": [
    "Still unverified: the CUDA path and the Windows launcher. This host has no NVIDIA GPU and no Windows."
  ],
  "decisions": [
    "The unsloth/embeddinggemma-2 repository was evaluated and rejected as a runtime source: it publishes safetensors with no GGUF and no projector, so it cannot serve the portable llama.cpp runtime; ggml-org supplies the Q8_0 GGUF pair that was already pinned",
    "No neural reranker was added: the operator requires speed and BM25-light stays the production family"
  ],
  "progress": {
    "blocked": [],
    "done": [
      "Closed the GPU-verification gap on the operator host: Vulkan is installed (AMD RADV RENOIR integrated GPU, 512 MiB carve-out). The device is detected, the runtime offloads to it, and text/image/audio/video all return valid 768-dim unit-norm vectors",
      "Verified the CPU-Vulkan parity gate on real hardware: cosine 0.999911 to 0.999953 against a 0.995 gate",
      "Implemented the plan's 1.10x throughput gate: the launcher now measures the CPU baseline and every validated GPU candidate and rejects a GPU that works but is slower. On this host the Vulkan profile measured 0.72x and was correctly rejected",
      "Fixed the device memory parser to use the FREE figure llama.cpp reports (32334 MiB, 30768 MiB free) instead of the total",
      "Verified the whole deployment end to end on this host: the launcher selected the CPU profile, the stack reported ready, and an MCP project.search returned a real Gemma 2 Q8_0 result carrying the rerank score and rank"
    ],
    "todo": []
  },
  "resume": {
    "next_action": "Commit the working tree and publish the production image; the deployment kit and the new MCP tools must reach an operator before the automatic backend selection and the LLM Wiki can be used.",
    "prerequisites": []
  },
  "runtime": {
    "last_failure_fingerprint": "",
    "next_decision": "stop",
    "no_progress_windows": 0,
    "repeated_failure_count": 0
  },
  "schema_version": "1.0",
  "session": {
    "created_at": "2026-10-25T14:42:13+00:00",
    "id": "portable-inference-runtime",
    "project": "ProjectExpert",
    "updated_at": "2026-10-25T22:37:32+00:00"
  },
  "task": {
    "acceptance": [
      "New pi_platform/core/inference package + cli/inference wired; deployment compose/lock/env updated to Gemma defaults with auto backend; suite green; compose config OK; real CPU inference for text/image/audio"
    ],
    "goal": "Implement Python-owned portable inference runtime policy (backend discovery, device selection, launch plan, degradation) and thin launchers",
    "openspec_change": "consolidate-embeddinggemma2-and-autoconfigure-inference",
    "status": "complete"
  },
  "verification": {
    "passed": [
      "python3 -m unittest discover -s tests -p test_*.py -> Ran 1525 tests, OK (skipped=14)",
      "python3 harness.py check -> Harness core checks: PASS",
      "Real deployment on this host: Selected inference backend: cpu; Rejected: cuda (probe failed); vulkan (not faster than the cpu baseline (speedup 0.67 < 1.10))",
      "MCP project.search over the running deployment returned a hit with rerankRank 1, rerankScore 0.0167 and the preserved retrieval score 0.0164"
    ],
    "pending": []
  },
  "working_set": []
}
