{
  "budgets": {
    "steps_max": 18,
    "steps_used": 0
  },
  "context": [
    "Remote 806c389 contains merge commits only; remote tree equals local fix parent 5914fd8; local ba4eb1c is unpublished"
  ],
  "decisions": [
    "Replay only unpublished CI fix over remote merge history; user attempted push authorizes completing normal push; no force push needed"
  ],
  "progress": {
    "blocked": [
      "Push authentication unavailable to agent: HTTPS returns 403 and SSH BatchMode rejects publickey; user must authenticate locally"
    ],
    "done": [
      "Remote merge commits preserved; CI fix replayed as f20d8c7; tree unchanged and 58 focused tests plus manifest pass"
    ],
    "todo": [
      "User runs git push with unlocked SSH key; confirm remote CI outcome"
    ]
  },
  "resume": {
    "next_action": "Run git push locally and enter SSH key passphrase; then inspect GitHub checks",
    "prerequisites": []
  },
  "runtime": {
    "last_failure_fingerprint": "",
    "next_decision": "continue",
    "no_progress_windows": 0,
    "repeated_failure_count": 0
  },
  "schema_version": "1.0",
  "session": {
    "created_at": "2026-10-07T21:21:52+00:00",
    "id": "integrate-remote-ci-fix",
    "project": "ProjectExpert",
    "updated_at": "2026-10-07T21:22:53+00:00"
  },
  "task": {
    "acceptance": [
      "Remote history preserved; replayed fix tree identical before task state updates; focused tests and manifests pass; normal push succeeds; clean working tree"
    ],
    "goal": "Integrate remote merge commits, preserve the CI fix, and complete a normal push",
    "openspec_change": "",
    "status": "blocked"
  },
  "verification": {
    "passed": [
      "Conflict-free rebase; git diff ba4eb1c replayed HEAD empty; Phase 1 58 PASS; artifact manifest PASS"
    ],
    "pending": []
  },
  "working_set": []
}
