{
  "budgets": {
    "steps_max": 120,
    "steps_used": 0
  },
  "context": [
    "Only test portability changed; current OpenSpec behavior remains unchanged and no new proposal is required",
    "Remote Windows 3.11/3.13 rerun not performed; commit must be pushed before GitHub can verify it",
    "Pre-existing timestamp change in prior handoff and unrelated untracked files excluded from commit"
  ],
  "decisions": [
    "Test portability fix only; existing platform contracts unchanged, no new OpenSpec behavior needed"
  ],
  "progress": {
    "blocked": [],
    "done": [
      "Inspected all four failed jobs in GitHub run 40411526993; failures match on Python 3.11 and 3.13",
      "Fixed native cache-path comparison and POSIX-only launcher fixture gating; regenerated artifact manifest"
    ],
    "todo": []
  },
  "resume": {
    "next_action": "",
    "prerequisites": []
  },
  "runtime": {
    "last_failure_fingerprint": "",
    "next_decision": "stop",
    "no_progress_windows": 0,
    "repeated_failure_count": 0
  },
  "schema_version": "1.0",
  "session": {
    "created_at": "2026-10-26T22:41:04+00:00",
    "id": "fix-windows-ci-pr11",
    "project": "ProjectExpert",
    "updated_at": "2026-10-26T22:45:17+00:00"
  },
  "task": {
    "acceptance": [
      "Diagnose all four failure logs; focused regression and harness checks pass; Windows validation limits recorded"
    ],
    "goal": "Fix Windows CI failures in PR 11 run 40411526993",
    "openspec_change": "",
    "status": "complete"
  },
  "verification": {
    "passed": [
      "15 focused regression tests PASS on Linux",
      "Windows path equivalence verified using PureWindowsPath",
      "python3 harness.py check PASS including tests, Wiki/OpenSpec checks, MCP and manifest"
    ],
    "pending": []
  },
  "working_set": [
    {
      "path": "tests/test_embedding_runtime_contracts.py",
      "sha256": "8dac2dd570e47cc4a42ddfe45347015edf4b647cdfe891eb59114bb7b92dcef3"
    },
    {
      "path": "tests/test_review_runtime_regressions.py",
      "sha256": "a3c1d91fc3dd99eea9b6ed70c438cb496c00cdf170de76050db489b73e617fee"
    }
  ]
}
