{
  "budgets": {
    "steps_max": 18,
    "steps_used": 0
  },
  "context": [],
  "decisions": [],
  "progress": {
    "blocked": [],
    "done": [
      "Phase 1 tasks 13-44 complete; 147 tests pass; harness.py check PASS; openspec validate PASS; wiki-validate PASS; implement-phase-1-foundation change archived"
    ],
    "todo": []
  },
  "resume": {
    "next_action": "",
    "prerequisites": []
  },
  "runtime": {
    "last_failure_fingerprint": "",
    "next_decision": "stop",
    "no_progress_windows": 0,
    "repeated_failure_count": 0
  },
  "schema_version": "1.0",
  "session": {
    "created_at": "2026-10-04T11:48:45+00:00",
    "id": "implement-phase-1-foundation",
    "project": "ProjectExpert",
    "updated_at": "2026-10-04T16:05:35+00:00"
  },
  "task": {
    "acceptance": [],
    "goal": "Implement Phase 1 Foundation per openspec/changes/plan-v0-8-platform-architecture/tasks.md (tasks 13-44) and archive the change.",
    "openspec_change": "implement-phase-1-foundation",
    "status": "complete"
  },
  "verification": {
    "passed": [
      "openspec validate PASS; harness.py check PASS; wiki-validate PASS; 155 tests pass including 100-iter property round-trip; deepseek-verify review findings fixed and committed"
    ],
    "pending": []
  },
  "working_set": []
}
