{
  "budgets": {
    "steps_max": 18,
    "steps_used": 0
  },
  "context": [],
  "decisions": [],
  "progress": {
    "blocked": [],
    "done": [
      "Fixed 7 review-identified bugs not covered by future OpenSpec/architecture: Windows _project_id, MCP ensure_index staleness, top_k dedup order, code_symbol re-scan, license inventory, container mutable tags, except Exception masking. Added 5 regression tests. All gates green."
    ],
    "todo": [
      "Final commit; do NOT push per preparation rules."
    ]
  },
  "resume": {
    "next_action": "git commit with descriptive message; do NOT push.",
    "prerequisites": []
  },
  "runtime": {
    "last_failure_fingerprint": "",
    "next_decision": "continue",
    "no_progress_windows": 0,
    "repeated_failure_count": 0
  },
  "schema_version": "1.0",
  "session": {
    "created_at": "2026-10-05T21:02:48+00:00",
    "id": "phase-4-retrieval",
    "project": "ProjectExpert",
    "updated_at": "2026-10-05T21:39:25+00:00"
  },
  "task": {
    "acceptance": [
      "All verification gates PASS; openspec validate prepare-phase-4-retrieval --strict returns valid; harness.py check returns PASS; wiki-validate remains ok; artifact-manifest PASS; Phase 1-3 regression suites green; no production code added; CURRENT.md and tasks.md rows 70-78 NOT flipped."
    ],
    "goal": "Author prepare-phase-4-retrieval OpenSpec change: 9 capability specs (embedding-model, hybrid-retrieval, multi-stage-retrieval, graph-expansion-production, reranker-port, metadata-filters, context-assembler, retrieval-benchmark) plus proposal/design/tasks/context-impact. NO production code; future implement-phase-4-retrieval consumes the contract.",
    "openspec_change": "prepare-phase-4-retrieval",
    "status": "executing"
  },
  "verification": {
    "passed": [
      "Phase 1-3 regression: Ran 151 OK; MCP tests: Ran 10 OK; openspec --all --strict: 32/0; artifact-manifest: PASS (596 files); wiki-validate: ok=true; license-gate: passed=true"
    ],
    "pending": []
  },
  "working_set": []
}
